{"$schema":"https://json-schema.org/draft/2020-12/schema","title":"Process Recommendation","type":"object","required":["schema_version","part_id","recommended_processes"],"properties":{"schema_version":{"type":"integer"},"part_id":{"type":"string"},"recommended_processes":{"type":"array","items":{"type":"object"}},"selected_process":{"type":["string","null"]}},"additionalProperties":true}
